{
  "schema_version": 1,
  "snapshot_date": "2026-09-28",
  "purpose": "Normalized discovery inventory for P4. Inventory does not grant execution authority.",
  "rules": {
    "default_admission_state": "REFERENCE_ONLY",
    "unknown_write_scope_fails_closed": true,
    "discovery_must_not_install_or_authenticate": true,
    "external_marketplace_sources_require_independent_provenance_audit": true,
    "package_audit_does_not_imply_subcapability_admission": true
  },
  "source_evidence": {
    "agent-skills-standard": {
      "reviewed_commit": "69ef37e9424c0a7ea9dd2293b559e43ec8176379",
      "reviewed_version": "skills-ref-0.1.0",
      "admission_state": "REFERENCE_ONLY",
      "audit_record": "catalog/vendor-audits/agent-skills-standard.json"
    },
    "openai-plugins": {
      "reviewed_commit": "5fd93af4cd0c623e020d0cc7e9ce178b4ac1f70f",
      "reviewed_version": null,
      "admission_state": "REFERENCE_ONLY",
      "audit_record": "catalog/vendor-audits/openai-plugins.json"
    },
    "duckdb-skills": {
      "reviewed_commit": "7feda8e01e22bc0886c86123f3884947e36d8c69",
      "reviewed_version": "0.2.4",
      "admission_state": "REFERENCE_ONLY",
      "audit_record": "catalog/vendor-audits/duckdb-skills.json"
    },
    "cloudflare-skills": {
      "reviewed_commit": "626547c06881a20b3322bdc2ed6e6451b33a4fb6",
      "reviewed_version": "1.0.1",
      "admission_state": "REFERENCE_ONLY",
      "audit_record": "catalog/vendor-audits/cloudflare-skills.json"
    },
    "microsoft-playwright-skills": {
      "reviewed_commit": "74354ecc7a43da16d91a9bc54fa8db8283a3fcf5",
      "reviewed_version": "0.1.21",
      "admission_state": "REFERENCE_ONLY",
      "audit_record": "catalog/vendor-audits/microsoft-playwright-skills.json"
    }
  },
  "summary": {
    "catalog_sources": 5,
    "openai_marketplace_plugins": 65,
    "openai_marketplace_external_sources": 3,
    "openai_marketplace_mcp_surfaces": 31,
    "openai_marketplace_plugins_with_scripts": 27,
    "audited_source_subcapabilities": 48
  },
  "marketplace_plugins": [
    {
      "capability_id": "openai-marketplace:linear",
      "source_id": "openai-plugins",
      "name": "linear",
      "kind": "MARKETPLACE_PLUGIN",
      "category": "Productivity",
      "marketplace_source": {
        "source": "local",
        "path": "./plugins/linear"
      },
      "policy": {
        "installation": "AVAILABLE",
        "authentication": "ON_INSTALL"
      },
      "structural_signals": {
        "skill_files_present": false,
        "mcp_manifest_present": true,
        "app_manifest_present": true,
        "scripts_present": false,
        "commands_present": false,
        "hooks_present": false,
        "agents_present": false
      },
      "authority_surface": {
        "authentication": "ON_INSTALL",
        "remote_write_scope": "UNKNOWN_UNTIL_NARROW_AUDIT",
        "destructive_scope": "UNKNOWN_UNTIL_NARROW_AUDIT",
        "publish_scope": "UNKNOWN_UNTIL_NARROW_AUDIT",
        "credential_scope": "UNKNOWN_UNTIL_NARROW_AUDIT"
      },
      "risk_flags": [
        "AUTHENTICATION_POLICY",
        "MCP_SURFACE"
      ],
      "admission_state": "REFERENCE_ONLY",
      "inventory_state": "DISCOVERED_NOT_NARROW_AUDITED",
      "next_action": "NARROW_AUDIT_ON_DEMAND"
    },
    {
      "capability_id": "openai-marketplace:atlassian-rovo",
      "source_id": "openai-plugins",
      "name": "atlassian-rovo",
      "kind": "MARKETPLACE_PLUGIN",
      "category": "Productivity",
      "marketplace_source": {
        "source": "local",
        "path": "./plugins/atlassian-rovo"
      },
      "policy": {
        "installation": "AVAILABLE",
        "authentication": "ON_INSTALL"
      },
      "structural_signals": {
        "skill_files_present": false,
        "mcp_manifest_present": true,
        "app_manifest_present": true,
        "scripts_present": false,
        "commands_present": false,
        "hooks_present": false,
        "agents_present": true
      },
      "authority_surface": {
        "authentication": "ON_INSTALL",
        "remote_write_scope": "UNKNOWN_UNTIL_NARROW_AUDIT",
        "destructive_scope": "UNKNOWN_UNTIL_NARROW_AUDIT",
        "publish_scope": "UNKNOWN_UNTIL_NARROW_AUDIT",
        "credential_scope": "UNKNOWN_UNTIL_NARROW_AUDIT"
      },
      "risk_flags": [
        "AUTHENTICATION_POLICY",
        "MCP_SURFACE"
      ],
      "admission_state": "REFERENCE_ONLY",
      "inventory_state": "DISCOVERED_NOT_NARROW_AUDITED",
      "next_action": "NARROW_AUDIT_ON_DEMAND"
    },
    {
      "capability_id": "openai-marketplace:google-calendar",
      "source_id": "openai-plugins",
      "name": "google-calendar",
      "kind": "MARKETPLACE_PLUGIN",
      "category": "Productivity",
      "marketplace_source": {
        "source": "local",
        "path": "./plugins/google-calendar"
      },
      "policy": {
        "installation": "AVAILABLE",
        "authentication": "ON_INSTALL"
      },
      "structural_signals": {
        "skill_files_present": false,
        "mcp_manifest_present": true,
        "app_manifest_present": true,
        "scripts_present": false,
        "commands_present": false,
        "hooks_present": false,
        "agents_present": false
      },
      "authority_surface": {
        "authentication": "ON_INSTALL",
        "remote_write_scope": "UNKNOWN_UNTIL_NARROW_AUDIT",
        "destructive_scope": "UNKNOWN_UNTIL_NARROW_AUDIT",
        "publish_scope": "UNKNOWN_UNTIL_NARROW_AUDIT",
        "credential_scope": "UNKNOWN_UNTIL_NARROW_AUDIT"
      },
      "risk_flags": [
        "AUTHENTICATION_POLICY",
        "MCP_SURFACE"
      ],
      "admission_state": "REFERENCE_ONLY",
      "inventory_state": "DISCOVERED_NOT_NARROW_AUDITED",
      "next_action": "NARROW_AUDIT_ON_DEMAND"
    },
    {
      "capability_id": "openai-marketplace:gmail",
      "source_id": "openai-plugins",
      "name": "gmail",
      "kind": "MARKETPLACE_PLUGIN",
      "category": "Communication",
      "marketplace_source": {
        "source": "local",
        "path": "./plugins/gmail"
      },
      "policy": {
        "installation": "AVAILABLE",
        "authentication": "ON_INSTALL"
      },
      "structural_signals": {
        "skill_files_present": false,
        "mcp_manifest_present": true,
        "app_manifest_present": true,
        "scripts_present": false,
        "commands_present": false,
        "hooks_present": false,
        "agents_present": false
      },
      "authority_surface": {
        "authentication": "ON_INSTALL",
        "remote_write_scope": "UNKNOWN_UNTIL_NARROW_AUDIT",
        "destructive_scope": "UNKNOWN_UNTIL_NARROW_AUDIT",
        "publish_scope": "UNKNOWN_UNTIL_NARROW_AUDIT",
        "credential_scope": "UNKNOWN_UNTIL_NARROW_AUDIT"
      },
      "risk_flags": [
        "AUTHENTICATION_POLICY",
        "MCP_SURFACE"
      ],
      "admission_state": "REFERENCE_ONLY",
      "inventory_state": "DISCOVERED_NOT_NARROW_AUDITED",
      "next_action": "NARROW_AUDIT_ON_DEMAND"
    },
    {
      "capability_id": "openai-marketplace:slack",
      "source_id": "openai-plugins",
      "name": "slack",
      "kind": "MARKETPLACE_PLUGIN",
      "category": "Communication",
      "marketplace_source": {
        "source": "local",
        "path": "./plugins/slack"
      },
      "policy": {
        "installation": "AVAILABLE",
        "authentication": "ON_INSTALL"
      },
      "structural_signals": {
        "skill_files_present": false,
        "mcp_manifest_present": true,
        "app_manifest_present": true,
        "scripts_present": false,
        "commands_present": false,
        "hooks_present": false,
        "agents_present": false
      },
      "authority_surface": {
        "authentication": "ON_INSTALL",
        "remote_write_scope": "UNKNOWN_UNTIL_NARROW_AUDIT",
        "destructive_scope": "UNKNOWN_UNTIL_NARROW_AUDIT",
        "publish_scope": "UNKNOWN_UNTIL_NARROW_AUDIT",
        "credential_scope": "UNKNOWN_UNTIL_NARROW_AUDIT"
      },
      "risk_flags": [
        "AUTHENTICATION_POLICY",
        "MCP_SURFACE"
      ],
      "admission_state": "REFERENCE_ONLY",
      "inventory_state": "DISCOVERED_NOT_NARROW_AUDITED",
      "next_action": "NARROW_AUDIT_ON_DEMAND"
    },
    {
      "capability_id": "openai-marketplace:teams",
      "source_id": "openai-plugins",
      "name": "teams",
      "kind": "MARKETPLACE_PLUGIN",
      "category": "Communication",
      "marketplace_source": {
        "source": "local",
        "path": "./plugins/teams"
      },
      "policy": {
        "installation": "AVAILABLE",
        "authentication": "ON_INSTALL"
      },
      "structural_signals": {
        "skill_files_present": false,
        "mcp_manifest_present": false,
        "app_manifest_present": true,
        "scripts_present": false,
        "commands_present": false,
        "hooks_present": false,
        "agents_present": false
      },
      "authority_surface": {
        "authentication": "ON_INSTALL",
        "remote_write_scope": "UNKNOWN_UNTIL_NARROW_AUDIT",
        "destructive_scope": "UNKNOWN_UNTIL_NARROW_AUDIT",
        "publish_scope": "UNKNOWN_UNTIL_NARROW_AUDIT",
        "credential_scope": "UNKNOWN_UNTIL_NARROW_AUDIT"
      },
      "risk_flags": [
        "AUTHENTICATION_POLICY"
      ],
      "admission_state": "REFERENCE_ONLY",
      "inventory_state": "DISCOVERED_NOT_NARROW_AUDITED",
      "next_action": "NARROW_AUDIT_ON_DEMAND"
    },
    {
      "capability_id": "openai-marketplace:sharepoint",
      "source_id": "openai-plugins",
      "name": "sharepoint",
      "kind": "MARKETPLACE_PLUGIN",
      "category": "Productivity",
      "marketplace_source": {
        "source": "local",
        "path": "./plugins/sharepoint"
      },
      "policy": {
        "installation": "AVAILABLE",
        "authentication": "ON_INSTALL"
      },
      "structural_signals": {
        "skill_files_present": false,
        "mcp_manifest_present": false,